{
  "viewSchemaVersion": "1.0",
  "viewId": "11111111-1111-4111-8111-111111111111",
  "requestId": "22222222-2222-4222-8222-222222222222",
  "viewType": "recipe",
  "revision": 1,
  "title": "Server recipes",
  "fallbackText": "The server returned one recipe.",
  "pinnable": true,
  "content": {
    "schemaVersion": "2.0",
    "query": {
      "mode": "lookup",
      "itemId": "minecraft:stone"
    },
    "selectedRecipe": 0,
    "totalMatches": 1,
    "truncated": false,
    "recipes": [
      {
        "recipeId": "minecraft:stone_from_smelting",
        "recipeType": "smelting",
        "source": {
          "kind": "server_registry",
          "providerId": null
        },
        "result": {
          "itemId": "minecraft:stone",
          "count": 1,
          "components": {}
        },
        "layout": {
          "kind": "single_input",
          "ingredient": {
            "choiceType": "material",
            "alternatives": [
              {
                "itemId": "minecraft:cobblestone",
                "count": 1,
                "components": {}
              }
            ]
          }
        },
        "remainingItems": [],
        "processing": {
          "timeTicks": 0,
          "experience": 0.1
        }
      }
    ]
  }
}
